video_id,title,channel_title,channel_id,published_at,category_id,thumbnail,view_count,like_count,comment_count
uJzq1WltOPM,Come with me to get a portrait tattoo of my son 🥰 (full blog coming soon),Dasia Temia,UCdUs3rJr3d1s-3Txm020-4A,2026-05-30T20:06:54Z,22,https://i.ytimg.com/vi/uJzq1WltOPM/default.jpg,251937,21394,181
Z3nbv0fAWG0,Last Day Of School Morning Routine *WE'RE MOViNG* 🎒🌴,Not Enough Nelsons,UC-_KiH_Z2yerhAD_cAjAMOA,2026-05-30T14:07:39Z,22,https://i.ytimg.com/vi/Z3nbv0fAWG0/default.jpg,490034,9464,918
KyU0B6K5e2Q,Went Back for the Cookbook!,MsEmilyRose11,UC7IpppizaKUrWIrQ0VWx41Q,2026-05-18T23:03:38Z,22,https://i.ytimg.com/vi/KyU0B6K5e2Q/default.jpg,812795,62380,3468
UMCvKPSNHCc,"a chill week in my life | makeup, therapy, chatting etc",charli d'amelio,UCi3OE-aN09WOcN9d2stCvPg,2026-05-30T21:26:20Z,22,https://i.ytimg.com/vi/UMCvKPSNHCc/default.jpg,133727,4198,283
AS0jpp2o2yk,Youtubers Style Me *however they want*,Mia Maples,UCzzOKT1SkE7qdycJvPCR3Gg,2026-05-22T17:00:12Z,26,https://i.ytimg.com/vi/AS0jpp2o2yk/default.jpg,1146198,63082,4567
n0fAsXMHDzU,SETTING UP OUR BEDROOM & BATHROOM!! cooking in the new kitchen!!,RemLife,UCXLnGIevWGWK2dPDcvM5-CA,2026-05-29T15:00:13Z,22,https://i.ytimg.com/vi/n0fAsXMHDzU/default.jpg,145385,3856,301
BFcQiGWCvTo,BUILDING MY DREAM HOUSE... Extreme Closet Renovation!!,morgans vlogs,UC-vaBe-YMpvcZL5rQ5OopZw,2026-05-31T17:34:03Z,22,https://i.ytimg.com/vi/BFcQiGWCvTo/default.jpg,57625,4046,360
OVaDbBU4A3U,I Quadrupled My Calories Every Day For 8 Days,Alex Ah Sue,UCV9Fju89m4XlxPHIhL9NThg,2026-05-30T15:00:29Z,24,https://i.ytimg.com/vi/OVaDbBU4A3U/default.jpg,146723,6208,539
rV-SgCONOG8,locked out of my apartment and no where to go (all nighter vlog),lana ♡,UCyZ4IStyXcaQwx7Xgl3TmWA,2026-05-23T21:39:51Z,24,https://i.ytimg.com/vi/rV-SgCONOG8/default.jpg,353682,25298,1308
XM-Dgji4bNQ,grwm to go out 🍸also that lip combo turned out to be perfection ✨ #grwm #chattygrwm #foryou #vlog,Ashley Paige,UCZA8j1IBoxCZ1kmx0BaVa2Q,2026-05-30T16:51:06Z,22,https://i.ytimg.com/vi/XM-Dgji4bNQ/default.jpg,113277,7082,196
VpvWObR2y68,My Remote Cabin Has a Serious Problem,Kelly Hays,UCfMHF8GPio8NAeP0loK1VmA,2026-05-31T22:02:48Z,24,https://i.ytimg.com/vi/VpvWObR2y68/default.jpg,56935,6431,505
MAl8v-1cFGM,Traveling Back Home to Mexico ❤️🇲🇽❤️ Our Life After Deportation,laguerita70 (laguerita70),UCLXitynaGJXzGCZH3Shx3aA,2026-06-01T01:00:22Z,22,https://i.ytimg.com/vi/MAl8v-1cFGM/default.jpg,45565,4758,198
15dIVxzj1tU,SUMMER day in my life @ HOME ⭐️🩷🪽 ,Nicole Laeno,UCr1nLIQFpNV5DxD22qxGsyQ,2026-05-31T19:00:01Z,26,https://i.ytimg.com/vi/15dIVxzj1tU/default.jpg,86981,5854,419
Ekurm09tJbM,The Second Trimester: A Week in the Life,Matt & Abby Howard,UC3zZX4ttC52HlqVis7eQ-Hg,2026-05-31T02:09:33Z,22,https://i.ytimg.com/vi/Ekurm09tJbM/default.jpg,101263,4078,162
BCgRYRwIsus,q&a!! relationship... throuple... secret lives oc...,Aspyn Ovard ,UCxjZe0qTFXh6jGm54LFWEDw,2026-05-27T19:00:48Z,22,https://i.ytimg.com/vi/BCgRYRwIsus/default.jpg,218815,4261,194
te8DxWODQiw,In honor of my 12th anniversary let’s revisit the time I ripped my dress out of the sealed,Jessica Secrest,UCxPtWxbojpMGbpQKXPthzuw,2026-05-24T13:04:51Z,22,https://i.ytimg.com/vi/te8DxWODQiw/default.jpg,131382,19783,969
DAuduhxil30,Also SO AFFORDABLE 👏🏼 can’t wait to try!! I’ll keep you guys updated Abbey Yung #hairtok,Haylee Hess,UCvqflBxkC8vOz-qLIaVZysA,2026-05-31T16:03:43Z,22,https://i.ytimg.com/vi/DAuduhxil30/default.jpg,70585,6539,66
ea0X-DWVOZo,Ending the vlogs.,PewDiePie,UC-lHJZR3Gqxm24_Vd_AJ5Yw,2026-05-23T11:11:14Z,20,https://i.ytimg.com/vi/ea0X-DWVOZo/default.jpg,1609732,115130,7360
v8Mb7gZy124,FURNITURE SHOPPING FOR OUR NEW HOME!!!!! SPENT 10.6K!!!!,Dano Maldonado ,UCU74oPNDl7U7eiO9CiuV-Gg,2026-06-01T01:56:14Z,22,https://i.ytimg.com/vi/v8Mb7gZy124/default.jpg,46530,2310,188
SBaq0RjCHVY,"came for the food, stayed for the food",Allison Kuch,UC03t5h5oMMbP2fWrNliDdUQ,2026-06-01T03:02:24Z,22,https://i.ytimg.com/vi/SBaq0RjCHVY/default.jpg,14336,2021,17
-ZDgwwJg24w,Unwell 🫠 idk what I’d do without the burger :’),tabithaswatosh shorts,UCLHj8JW-Ah60QvbchkLqs8g,2026-05-20T14:42:43Z,22,https://i.ytimg.com/vi/-ZDgwwJg24w/default.jpg,225116,14526,16
1KSJ2pF-1kA,I stayed up for 24h..,Randa Rosa,UCN_q4RSGPxo7IsFtLSRkSQQ,2026-05-19T18:00:01Z,22,https://i.ytimg.com/vi/1KSJ2pF-1kA/default.jpg,683382,48412,443
BYYFWUTJMOs,"The Full Story | The Girl Who Died on my Study Abroad Trip & ""The Predator of Seville""",Siobhan Brier Aguilar,UCpviVPWIL__kCj_IITmwnKg,2026-05-28T18:51:42Z,22,https://i.ytimg.com/vi/BYYFWUTJMOs/default.jpg,113605,5340,544
_DIv6lJPkBI,I moved to Maui and am DAILY VLOGGING NOW (like actually.),Tana Mongeau,UClWD8su9Sk6GzZDwy9zs3_w,2026-06-01T00:23:55Z,19,https://i.ytimg.com/vi/_DIv6lJPkBI/default.jpg,50472,2717,285
YyLpQkkzIho,16 Crops You Should Plant In June ASAP,Epic Gardening,UCSbyncU597LMwb3HhnAI_4w,2026-05-28T22:59:52Z,26,https://i.ytimg.com/vi/YyLpQkkzIho/default.jpg,89982,3978,354
xrTPUEV0WCY,Day in my life in traveling from Chiang Mai to Hanoi,Kaitlyn Lavery,UCqZDrYZzMKawDbxV-SiMLAQ,2026-05-26T16:00:37Z,22,https://i.ytimg.com/vi/xrTPUEV0WCY/default.jpg,97971,7896,84
xr41dIlgkUA,New chapter 🦋,Lauren Giraldo,UCRilWe8hfa-jQhwqnoJFH2A,2026-05-27T15:19:01Z,24,https://i.ytimg.com/vi/xr41dIlgkUA/default.jpg,116732,3123,682
oo38h6299B0,We Drove Across America - Day 5,Mack 2.0,UCF0eCAP6Nc2Kfy0a7L8aI_g,2026-05-28T15:53:31Z,22,https://i.ytimg.com/vi/oo38h6299B0/default.jpg,89930,5962,1270
Wk9hsQr8DYs,Budget $150 with me 🛍️🤩 #fypシ #toryburch #toryburchsandals #coffee #starbucksdrink #nailidea,Cindy Dionicio🦋,UC5Z_NfkksSQl4XmbLa8ZMGQ,2026-06-01T00:59:40Z,22,https://i.ytimg.com/vi/Wk9hsQr8DYs/default.jpg,15766,2392,32
dGJ58TG5Vxk,I Ate ONLY Clearance Food for 7 Days | $50 Grocery Challenge,Julia Pacheco,UCi_58-g6BjEkhbYRtXBDTHg,2026-05-31T14:00:03Z,28,https://i.ytimg.com/vi/dGJ58TG5Vxk/default.jpg,31944,2653,559
ub9h85lbiNQ,2026 Dollar Tree & Thrift Store Hacks You'll Want Immediately ✨👀,Do It On A Dime,UCJA8OyDxRY-wm0ya2gtHOsw,2026-05-27T18:06:39Z,26,https://i.ytimg.com/vi/ub9h85lbiNQ/default.jpg,86256,8648,194
ExFusLdi-mE,The Ardmore Safari Table Parade Comes Home for its First Dinner!,The Chateau Diaries,UCyqPuqFXuAP5GMwRNFg5hpA,2026-05-29T23:00:06Z,22,https://i.ytimg.com/vi/ExFusLdi-mE/default.jpg,100636,14040,727
Qt0AqZpRMhM,PREPARING FOR OUR FIRST GROUP OF GUESTS IN TUSCANY,Nicki Positano,UCiTHbmAiRSsYTK9BRmWsMsA,2026-05-31T15:30:19Z,19,https://i.ytimg.com/vi/Qt0AqZpRMhM/default.jpg,49660,5857,311
CfA3NaCW5Lk,$1000 Dinner for me + $15 dinner for my family,Shayla Talei,UC5b_CPhlnUEUyhVzX_ARDSA,2026-05-14T19:55:22Z,22,https://i.ytimg.com/vi/CfA3NaCW5Lk/default.jpg,1149361,138596,1096
yWPuVABQ4gY,"What Made Me Stronger, Pool Add on Fail, If I Were A Boy | Mayhem Vlog",Peyton Maree Charles,UCpJlwAazmvuuuWC9PFTH-Ow,2026-05-31T03:08:13Z,22,https://i.ytimg.com/vi/yWPuVABQ4gY/default.jpg,27916,4494,898
7U1dDziQUvw,grem for the airport!! ✈️ #travel #grwm #getreadywithme #relatable #morningvlog #makeup #airport,Lauren Kim,UCWSwub1biYJX59p3cSSxR5g,2026-05-30T22:25:58Z,26,https://i.ytimg.com/vi/7U1dDziQUvw/default.jpg,114149,14907,80
-rGI683xkS0,Cancer Has Grown (Results) *Cancer Journey 2026*,tiffanythinks,UCGuL-e-ka0avJT35zFk0o5Q,2026-05-28T16:30:23Z,26,https://i.ytimg.com/vi/-rGI683xkS0/default.jpg,126753,9582,3155
pBqTCJl00b0,graduation diaries | photos + graduation day + GRAD BASH 2026,Nely Cuevas,UCiPV7RblxaUF6Z4BpTtlVqA,2026-05-28T01:05:37Z,22,https://i.ytimg.com/vi/pBqTCJl00b0/default.jpg,104336,3382,83
rOTbX7oQyJY,GRWM MORNING VLOG 🩵🌼💐,Lisi Shops,UCYh931jrUVrrISOGV1qyVtw,2026-05-25T21:59:01Z,22,https://i.ytimg.com/vi/rOTbX7oQyJY/default.jpg,372521,31795,1625
6XpTM9W7nY4,WE ARE MOVING!,Brooklyn and Bailey,UC6QWhGQqf0YDYdRb0n6ojWw,2026-05-20T21:00:10Z,24,https://i.ytimg.com/vi/6XpTM9W7nY4/default.jpg,467086,12620,433
09h0NHCupYk,Rhett’s Graduation + Brock’s BIG Birthday Surprise ! He did not expect this!,The LeRoys,UCRPIJ_-fU0fycIi4a6PUXRg,2026-05-29T18:44:53Z,24,https://i.ytimg.com/vi/09h0NHCupYk/default.jpg,78164,2332,179
GEK00F_Lp2s,So the Cottage Garden Has to Wait… + a Rainy Week on the Land,HEY WANDERER,UCTXClH9eLcYtCw0vIZlbsZA,2026-05-31T14:00:29Z,22,https://i.ytimg.com/vi/GEK00F_Lp2s/default.jpg,23733,3205,208
7Mb_5fx7YvY,our homestead changed forever today...,Mr and Mrs Adventure,UC9fSBF61eAEI2JOcFrM2Mng,2026-05-31T14:00:21Z,26,https://i.ytimg.com/vi/7Mb_5fx7YvY/default.jpg,51532,7909,697
9Xy6OvOyMQc,how a productive 24hrs living with my boyfriend looks like (business owners),Jathaly,UCABbEMDC2EdsLuF0pkoV_cg,2026-05-23T01:16:39Z,22,https://i.ytimg.com/vi/9Xy6OvOyMQc/default.jpg,200809,6937,204
4_4gC38pFyM,I avoided this DIY for 3 years & vintage decor shopping | MaCenna Lee,"XO, MaCenna Vlogs",UCxVEsOhpjLTRKNUSA8e0mfA,2026-05-28T21:00:36Z,24,https://i.ytimg.com/vi/4_4gC38pFyM/default.jpg,67333,6031,187
gNcl53VE6J4,Mall Vlog *We Actually Spent Money**,Jayla and Aydah ,UCD3PTAXfTSx2mRyky8JC3Ew,2026-05-25T23:51:20Z,24,https://i.ytimg.com/vi/gNcl53VE6J4/default.jpg,91806,2976,89
zKvxBgGvw2o,london_vlog.mov,Mandy's iPhone,UCZR4ioZxU0e18LzT7UKMdSw,2026-05-22T22:41:38Z,22,https://i.ytimg.com/vi/zKvxBgGvw2o/default.jpg,202872,10346,510
d2JV_fqQM7w,"What Happens in Vegas, Stays in Vegas... No Regrets!",CRAZY MIDDLES,UCzVxzz60KHq5Bgqf1zqoocg,2026-05-30T00:49:10Z,22,https://i.ytimg.com/vi/d2JV_fqQM7w/default.jpg,46510,2913,166
XqmtoOTUt4Y,They Lied to Me,Sarah Berkowitz,UCwh3ZT6P2DqEsTa9Kc82LuQ,2026-05-30T16:00:29Z,22,https://i.ytimg.com/vi/XqmtoOTUt4Y/default.jpg,36573,3803,238
fCisrP0M8gg,Everything went WRONG this week! WEEK IN MY LIFE VLOG,AlondraDessy (alondradessy),UC0psAD-M4X6O0yC_hFRK4hw,2026-05-29T00:59:29Z,22,https://i.ytimg.com/vi/fCisrP0M8gg/default.jpg,43460,1738,174
aY-bsiEkp0s,We're having a GENDER REVEAL,Taylor & Soph,UCGpTVLn8eqAMXoxNh82kK5A,2026-05-29T21:00:31Z,22,https://i.ytimg.com/vi/aY-bsiEkp0s/default.jpg,64362,2745,166
WudVGG-pS9w, MY TURN TO SPEAK & F$*% WHO DON’T LIKE IT • MY RESPONSE TO THE I DO 👰 • WHY SPECULATE I’LL TELL YOU,Jay Corine,UCD43sKZ5d-Mav9Zy218Xqkw,2026-05-31T22:09:46Z,22,https://i.ytimg.com/vi/WudVGG-pS9w/default.jpg,16880,2274,328
ALnZH7TJnIk,a BUSY weekend in my life | what it’s like managing a business (coffee shop) ,Jacob Macias,UC8ph5g5vKPMGWNgjA72Ur0A,2026-05-31T00:35:11Z,22,https://i.ytimg.com/vi/ALnZH7TJnIk/default.jpg,33246,1467,34
0v-vU6OjyHU,Faves + Fails May 2026,HotandFlashy,UCU9rHRAeSzi--j1jkXQ47RA,2026-05-29T11:30:36Z,26,https://i.ytimg.com/vi/0v-vU6OjyHU/default.jpg,45815,5302,253
6Ais3DA9LFA,SENDING OUR TEENAGE SON TO MALAYSIA FOR THE SUMMER | EMOTIONAL SENDOFF INTERNATIONAL GOODBYE,This Is How We Bingham,UCRJ4Qv94dh3p4TvocJ0Hptw,2026-05-26T20:32:09Z,22,https://i.ytimg.com/vi/6Ais3DA9LFA/default.jpg,71336,4116,
nb_8SnTZUMo,Pack with me for my Birthday trip 🏝️ #birthday #vacay #packwithme,Kat Clark,UCFiIJEdXb4ZWeK8zYDIaqPQ,2026-05-27T00:09:12Z,22,https://i.ytimg.com/vi/nb_8SnTZUMo/default.jpg,153834,13919,108
pf-7o1HirY0,350 Miles on Panheads! (Will We Make It?) - Vlog 251,THRASHIN SUPPLY,UCDy-dFyhXDV_7B8oHKSrneQ,2026-05-26T23:00:06Z,2,https://i.ytimg.com/vi/pf-7o1HirY0/default.jpg,73717,3800,220
PJ-cprMdKA8,Are you paying attention and preparing accordingly? #farmblog #gardening,Humble Servants Homestead,UCVoeq09rDbd-LL5NFwYIfHw,2026-05-26T13:19:48Z,22,https://i.ytimg.com/vi/PJ-cprMdKA8/default.jpg,149168,30433,1776
B-ePaCG4dos,School's Out! Our First Summer Trip of 2026 ☀️ MDW Weekend Vlog | Life As We Gomez,Life As We GOmez,UCVnEvilFBSA4BRgP1xRJ92w,2026-05-30T19:57:31Z,22,https://i.ytimg.com/vi/B-ePaCG4dos/default.jpg,64539,1826,219
hht_hwyAUrM,it’s starting to feel like summer in hawaii!!,Ava Jules,UCNqLK36Gm214qufpgC5C45w,2026-05-31T18:00:49Z,26,https://i.ytimg.com/vi/hht_hwyAUrM/default.jpg,22753,1249,95
WT2AIeqkon0,"BFF Day with Remi and Alisha!!! Viral Candy, Movies and More!! 🛍️💕",AlishaMarieVlogs,UCF1Q_zp3Eh3nuEHvMbdKkqg,2026-05-23T16:00:38Z,26,https://i.ytimg.com/vi/WT2AIeqkon0/default.jpg,149308,4121,157
Wb_tI98FT9E,Honoring Those Who Gave All: Memorial Day Cookout | Sharing Recipes,thepressleygirls,UC0o2n1IkGL93VmbTtVrtbsg,2026-05-30T22:55:59Z,10,https://i.ytimg.com/vi/Wb_tI98FT9E/default.jpg,22963,2363,238
LAiFBnpMwiE,Finding Latte A New Home 🐶🩷,imofficialm,UCmxKY7zmlhC-ZRLzrYjf61Q,2026-05-29T23:53:14Z,24,https://i.ytimg.com/vi/LAiFBnpMwiE/default.jpg,34425,2655,513
VBIviOmzppA,"hanging & resetting my life 🌟🫧🚕 (routines, updates, baking dot cakes, NYC trip, + more!)",Sara Carrolli,UCqtjdWqX85SKxVwCRgaJbkw,2026-05-31T14:34:40Z,22,https://i.ytimg.com/vi/VBIviOmzppA/default.jpg,27073,1866,76
Vc1RX7-xLcg,I have to move back to Jamaica 🇯🇲 ,Alicia Kim,UCzq-GBe1v0fkptsNnVr6DHQ,2026-05-30T23:10:52Z,22,https://i.ytimg.com/vi/Vc1RX7-xLcg/default.jpg,39421,3168,192
s8bNrCMxA4A,"Planting Sumac, Serviceberry Hedge & So Many Plants…..",Visit Our Garden,UCABd-G-yaqjdqob1cfeM93A,2026-05-27T09:30:34Z,26,https://i.ytimg.com/vi/s8bNrCMxA4A/default.jpg,35001,3489,268
E3-JLQvfZP0,packing up our house got more emotional than expected…,The Stewart Fam,UClqb063g490oxAxD7wxANaA,2026-05-24T21:00:20Z,22,https://i.ytimg.com/vi/E3-JLQvfZP0/default.jpg,96651,6457,284
s0ThYc9LFLA,"girls trip to Anna Maria island: golfcarting, sunrise swims, and chaos",Natalie Zacek,UCdaxSc8XWgjRJ1saDlr7JNQ,2026-05-24T14:02:09Z,22,https://i.ytimg.com/vi/s0ThYc9LFLA/default.jpg,112427,3075,155
XP9G40eZbWY,NEW HOME UPDATE! + FULL FAM CHAI TIME ❤️ - S3E112,Aary Vlogs,UCJDi0rEMsc3dsF3H18p3XIQ,2026-05-30T10:16:52Z,22,https://i.ytimg.com/vi/XP9G40eZbWY/default.jpg,347386,8422,463
-QeSsRqdQUY,HOUSTON TO FRANCE...  MY FULL TRAVEL DAY VLOG !,Life As Nique,UCkd3JAKRLQ-Bo7uxJDazu2Q,2026-05-26T18:20:02Z,24,https://i.ytimg.com/vi/-QeSsRqdQUY/default.jpg,45202,2665,142
yl9g0EcMnEA,Are We Quitting YouTube? | The Truth,Elsa Rhae & Barron,UCaXSPxQxctfY_7smdTVkK6w,2026-05-27T22:00:06Z,22,https://i.ytimg.com/vi/yl9g0EcMnEA/default.jpg,57169,6980,471
ppbqgbwJGy8,An alarming 2am FaceTime call...,JesssFam,UCpE_yAyidJKIsv8mnX1VYzA,2026-05-31T04:53:06Z,22,https://i.ytimg.com/vi/ppbqgbwJGy8/default.jpg,31133,1568,70
ehRAvdhS6CI,درد دل + ویدیوهای قدیمی,Mia Plays,UC3Uv6kBh55Jx0Ou0C7-Gudg,2026-05-28T07:48:45Z,24,https://i.ytimg.com/vi/ehRAvdhS6CI/default.jpg,246980,4919,8380
4TRlYbXODR0,My Inlaws Will Buy Us A New House🥹This Will Be Our New Journey!🏠,MariaRose Vlog,UCRb0eSuerIIJo8d_hnPiK_w,2026-05-30T02:43:21Z,22,https://i.ytimg.com/vi/4TRlYbXODR0/default.jpg,69845,2399,405
Bgk9EZT8Fjs,Seoul much fun in Korea,Stas Karanikolaou,UCMHKlaUOwMvgZ339zcjEI2A,2026-05-26T21:08:42Z,22,https://i.ytimg.com/vi/Bgk9EZT8Fjs/default.jpg,163245,5198,210
FV7bTAdMqLs,2 Hours of Gardening in 26 Minutes,Jacques in the Garden,UC2UruAEdaagf4JdtnMP-LrQ,2026-05-27T18:43:56Z,27,https://i.ytimg.com/vi/FV7bTAdMqLs/default.jpg,39317,2185,97
RT2UnBjhv1g,I GOT MY WEDDING TRIAL HAIR/MAKEUP DONE! THESE ARE MY RESULTS👰🏻‍♀️,Bri & Fern,UCnB4LOZe6Dc5JUH9EoaHhKQ,2026-05-28T20:23:28Z,1,https://i.ytimg.com/vi/RT2UnBjhv1g/default.jpg,26964,863,139
P6r3VhfbF7o,Chill Days In Houston | Gym Consistency + Grad Party + Memorial Day BBQ | Gina Jyneen,Gina Jyneen,UCBv95rZbQBPJs0lkyd7nmdg,2026-05-28T21:28:06Z,26,https://i.ytimg.com/vi/P6r3VhfbF7o/default.jpg,28456,1777,146
mCkD0dK-BZ0,Estamos Viviendo Nuestros Duelo 🖤 - Ruthi San ♡,Ruthi Family Vlogs,UCOBx8y7hTi0q7AGaZEqPKKg,2026-05-18T13:12:12Z,24,https://i.ytimg.com/vi/mCkD0dK-BZ0/default.jpg,908535,60923,13685
Ss6n9msUjhE,Homebody in New York | An introvert's ideal way of recharging after a busy week is eating alone,Michelle Choi,UCqJODva8CJ_JTbi5ssC2L-g,2026-05-28T00:49:35Z,26,https://i.ytimg.com/vi/Ss6n9msUjhE/default.jpg,209007,6564,94
9FIXmOph3sU,"weekend vlog: life with a puppy, realistic days, thrifting for Europe + solo beach day",Emma Marie,UC3eQ_-7h-6jsqh4Mb7XzfiQ,2026-05-26T20:00:32Z,22,https://i.ytimg.com/vi/9FIXmOph3sU/default.jpg,46480,1922,229
BWC8aFdoazA,The Heat Is On! Road Trips and Familiar Faces! EP. 89! ,A new life in central France,UCKeBic3ELwe6siJH7pIw0-A,2026-05-30T21:00:06Z,24,https://i.ytimg.com/vi/BWC8aFdoazA/default.jpg,39853,8462,231
tXPfbPckCN8,"I’m Leaving London Again, But I Need To Explain Why",Evan Edinger,UCT7H_xchRHaT9zr5GalIZVA,2026-05-31T17:00:34Z,27,https://i.ytimg.com/vi/tXPfbPckCN8/default.jpg,97792,7450,509
wdcgk7VwVrM,We Had Nothing To Wear 🤯 GRWM for Our First Night Out Together + Spa Day with Mom | VLOG#2255,Forever Family Vlogs,UCCavka0AbNklF4cqfaiwqEA,2026-05-27T18:00:27Z,1,https://i.ytimg.com/vi/wdcgk7VwVrM/default.jpg,44864,1056,27
Q__amtSXNx8,I’m installing walls in my container house!,Building a Dream ,UCLsXn6fY9cRgxYfCFgT1D_w,2026-05-31T10:00:13Z,22,https://i.ytimg.com/vi/Q__amtSXNx8/default.jpg,63198,5713,159
XahtBaEMfCs,These Looksmaxxing Family Vloggers Are BEYOND Disturbing...,Crooked Timber,UC4HRlp7zs7UpIFM67eGjhow,2026-05-27T20:48:06Z,22,https://i.ytimg.com/vi/XahtBaEMfCs/default.jpg,74571,2969,425
WdvoB9G96Os,ASÍ FUE MI CITA PRENATAL A LAS 39 SEMANAS | ¿Inducción? + haul de último momento 🤰,DinaStars,UCzkdyqNEPDzoiaCXwQQxdWw,2026-05-31T18:00:06Z,22,https://i.ytimg.com/vi/WdvoB9G96Os/default.jpg,28892,2929,112
EMc_uwYv8Do,"Memorial Day, Is My Arm Okay, Pictures from Granny's & Wisdom from the Comments",Celebrating Appalachia,UCP87Uu3q9IDUpEl1xr8-VQA,2026-05-25T23:26:09Z,22,https://i.ytimg.com/vi/EMc_uwYv8Do/default.jpg,28800,2494,373
4oDsp3ChWUw,"productive week at home: cooking, workouts & prepping for our first store opening",Paige Lorenze,UCiBm-VyAD9rud1xBgyl-fUQ,2026-05-26T17:36:34Z,10,https://i.ytimg.com/vi/4oDsp3ChWUw/default.jpg,80076,2081,223
TT2RkwF7cY4,Food Prices Are About to Surge… Start Growing NOW,Self Sufficient Me,UCJZTjBlrnDHYmf0F-eYXA3Q,2026-05-31T11:23:36Z,26,https://i.ytimg.com/vi/TT2RkwF7cY4/default.jpg,42189,4286,594
3irBopZFJDA,"nyc week in our life | amazing matcha, misi famous ricotta toast + memorial day weekend",Brigette and Danielle ,UCn6k8n3uXJrdnUMtfMhm8iA,2026-05-25T20:55:14Z,22,https://i.ytimg.com/vi/3irBopZFJDA/default.jpg,71213,1314,65
DMhWPdLeel4,The End of My Dream Property… and the Start of a New Chapter,The Indie Projects,UCWq4rBWfctWP0duZwofs61w,2026-05-30T14:00:35Z,22,https://i.ytimg.com/vi/DMhWPdLeel4/default.jpg,40051,5943,208
DXCu4_rOg-A,The Little Details Changed Everything ✨ Small Bathroom Decorating,Dainty Diaries,UCcx0GWauE1_cQYSkk70y0YA,2026-05-28T18:00:12Z,26,https://i.ytimg.com/vi/DXCu4_rOg-A/default.jpg,45963,5547,585
eKtzyLKt1LA,a week at home (finally) l Olivia Jade,Olivia Jade,UCmOKlMHHTV4DX3t21j3itPw,2026-05-26T21:30:54Z,26,https://i.ytimg.com/vi/eKtzyLKt1LA/default.jpg,79386,2460,126
xM9dNI8PcN0,moving into my new york city apartment,madeline argy,UCw24-aQvuVMP3C8gAduidPg,2026-05-25T02:35:09Z,22,https://i.ytimg.com/vi/xM9dNI8PcN0/default.jpg,222426,11138,336
4YuGqqLkEko,MORE PROBLEMS WITH MY LONDON APARTMENT! | MY LONDON LIFE,Jo Good - MiddleAgedMinx,UCPdKVL2QgDfBXcIW3jC3B2Q,2026-05-31T08:59:46Z,22,https://i.ytimg.com/vi/4YuGqqLkEko/default.jpg,45117,4292,670
KHAHUgj-ojU,What we ate at a movie theater in the US,Jeanelleats,UCU03NklypYW1AAIoNE2Vh1g,2026-05-22T13:00:22Z,22,https://i.ytimg.com/vi/KHAHUgj-ojU/default.jpg,311100,19790,166
GZq-5QphL5U,HOUSE TOUR DE LA NUEVA CASA DE MI HIJA🏠 RECUERDOS DEL APTO ANTERIOR 💖 PASEO POR SAN ANTONIO 🇺🇸,Sandy Y Fercho Vlogs 🏠💝,UCItPRvffi0mFD4bpeyb5RnA,2026-05-27T15:00:11Z,24,https://i.ytimg.com/vi/GZq-5QphL5U/default.jpg,58654,4644,391
GM7j-Xo6VmQ,Delivery Day Vlog 🏥 | TOO Emotional🥰 Divyanka Tripathi | Vivek Dahiya,Divyanka Tripathi Dahiya,UCfptQBghypEV0U5cDaW2jsg,2026-05-27T14:00:24Z,26,https://i.ytimg.com/vi/GM7j-Xo6VmQ/default.jpg,2310461,46487,1423
-wONmMdaXa0,BABY SE PEHLE YE TRIP BAHUT IMPORTANT THA❤️,Sambhavna Seth Entertainment,UChZ0JmGgyOWSU-1iXxPhsVA,2026-05-27T12:18:58Z,22,https://i.ytimg.com/vi/-wONmMdaXa0/default.jpg,491549,19708,856
p0Gn8xmtdFs,"Saturdays at lakes, Sundays at chateaus",Brian's life in France,UC6Kr-vxexB1NPnL-q9DjNuA,2026-05-25T18:38:44Z,22,https://i.ytimg.com/vi/p0Gn8xmtdFs/default.jpg,35460,7942,286
U8EH2CSWYuQ,"3년 차 승무원 아줌마의 연간 트레이닝 브이로그, 밥 줄 챙기느라 아이들, 남편 분량 적어서 미리 사과드립니다🙇‍♀️🙏🏻",콜미진 callmejin,UCBqIfMIcfGn1bhP8BWnafAQ,2026-05-31T01:03:11Z,22,https://i.ytimg.com/vi/U8EH2CSWYuQ/default.jpg,160661,11280,467
Z_onrnRgqrQ,WHY I DECIDED TO SELL MY BAGS | Amelia Liana ,Amelia Liana,UC-RX7Rb0D8xmWGWIwL8kvmQ,2026-05-31T08:13:38Z,22,https://i.ytimg.com/vi/Z_onrnRgqrQ/default.jpg,36523,1284,102
Ak1yVoCpfEA,"LETS SPEND A WEEK TOGETHER | BABY PREPPING, I GOT A NEW CAR, HOUSE UPDATES | VLOG | MOLLYMAE",MollyMae,UC-F3kTU4V680v550AavEOsQ,2026-05-26T19:15:48Z,22,https://i.ytimg.com/vi/Ak1yVoCpfEA/default.jpg,681921,13030,1036
VlK8V8JoIbI,Spend a work day with me in London (during a heatwave),Maddie Borge,UCkfTm3HfC4Fqr5dTPJHc9Fg,2026-05-28T16:48:38Z,26,https://i.ytimg.com/vi/VlK8V8JoIbI/default.jpg,152895,7246,88
Whq85Cwq9as,WE MADE IT TO THE MENTAWAI’S ,Nathan Florence,UC6uX6GF5q2JxLjMkyivM2Og,2026-05-22T20:25:25Z,22,https://i.ytimg.com/vi/Whq85Cwq9as/default.jpg,135987,3039,178
atj94Cz6o2c,I’ve always never liked my name until today 😉 @Evereden @Saie @Makeup By Mario @Emi Jay @rhode ski,Kriss and Esme,UCMkea5LTrZzoL7-g1B8QwPA,2026-05-03T01:19:28Z,22,https://i.ytimg.com/vi/atj94Cz6o2c/default.jpg,1117713,54228,354
ekIq39Nscys,Air India Gave Me a Muslim Meal But No Window Seat ✈️🍛,DCT EATS,UC2aX2oIi2TRzXlzbfbSy_dA,2026-05-10T08:59:13Z,22,https://i.ytimg.com/vi/ekIq39Nscys/default.jpg,2620890,130583,1199
TFb5VZbTWW8,China’s INSANE Bullet Train 🇨🇳 Beijing to Shanghai in Business Class,WildLens by Abrar,UCf1XIplYiqNv9baGsFHwPPQ,2026-05-10T14:53:58Z,19,https://i.ytimg.com/vi/TFb5VZbTWW8/default.jpg,974171,22310,955
