video_id,title,channel_title,channel_id,published_at,category_id,thumbnail,view_count,like_count,comment_count
ISgqpOpw174,MOViNG BACK to the CASTLE HOUSE! *Telling the Kids!* 🥹,Not Enough Nelsons,UC-_KiH_Z2yerhAD_cAjAMOA,2026-06-04T16:33:05Z,22,https://i.ytimg.com/vi/ISgqpOpw174/default.jpg,747550,14800,1468
x4osQNx54aI,I CAUGHT Bricks and Minfiigs!,MandRproductions,UCLnr9MzQ_v_a_OPmJkye5lA,2026-06-06T07:19:54Z,24,https://i.ytimg.com/vi/x4osQNx54aI/default.jpg,180129,7194,1926
tKDlpvo_OEQ,They Grow 80% Their Food AND Earn $100k From a 1 Acre Backyard!,Anne of All Trades,UCCkFJmUgzrZdkeHl_qPItsA,2026-06-03T15:12:30Z,26,https://i.ytimg.com/vi/tKDlpvo_OEQ/default.jpg,193592,9469,448
LEh3FMCtnqk,time to re-up on new ones! #vlog,DerosaBloomBlue,UC6CtgUrTz2gbeBTOnp7NkoQ,2026-06-06T02:41:39Z,22,https://i.ytimg.com/vi/LEh3FMCtnqk/default.jpg,41881,3106,54
_DIv6lJPkBI,I moved to Maui and am DAILY VLOGGING NOW (like actually.),Tana Mongeau,UClWD8su9Sk6GzZDwy9zs3_w,2026-06-01T00:23:55Z,19,https://i.ytimg.com/vi/_DIv6lJPkBI/default.jpg,251048,8903,639
MxYHSkqVCLI,The tradition lives on!!🥹🥳✨🎁 Okay but “mani and pedi from mommy” is SO SWEET😭💅🏼 Olive & June,Sabriena Abrre,UCJ8OmrAr0QTrS42G5o6R5dw,2026-06-06T18:02:47Z,22,https://i.ytimg.com/vi/MxYHSkqVCLI/default.jpg,39278,6429,57
GHREr0l9Tbk,Life Updates: Prepping for the Bachelorette + Painting the Guest Room!! 🏡🔨💕,AlishaMarieVlogs,UCF1Q_zp3Eh3nuEHvMbdKkqg,2026-06-05T15:45:07Z,26,https://i.ytimg.com/vi/GHREr0l9Tbk/default.jpg,66179,2672,127
SBaq0RjCHVY,"came for the food, stayed for the food",Allison Kuch,UC03t5h5oMMbP2fWrNliDdUQ,2026-06-01T03:02:24Z,22,https://i.ytimg.com/vi/SBaq0RjCHVY/default.jpg,132960,8261,55
UMCvKPSNHCc,"a chill week in my life | makeup, therapy, chatting etc",charli d'amelio,UCi3OE-aN09WOcN9d2stCvPg,2026-05-30T21:26:20Z,22,https://i.ytimg.com/vi/UMCvKPSNHCc/default.jpg,224415,6182,350
WfE9aHbluX8,big updates... I'm starting over (& why I decided to sell...),Tara Michelle,UCN0jjRU6bdRf1vEmvpoyveg,2026-06-05T16:00:20Z,24,https://i.ytimg.com/vi/WfE9aHbluX8/default.jpg,79093,4619,540
BFcQiGWCvTo,Transforming My Empty Room into a LUXURY Walk-In Closet,morgans vlogs,UC-vaBe-YMpvcZL5rQ5OopZw,2026-05-31T17:34:03Z,22,https://i.ytimg.com/vi/BFcQiGWCvTo/default.jpg,147063,8013,591
0KHh-qr1_Bw,First time on China’s high speed train for my parents,The Fisher-Zhangs in China,UCSuelocmXItJsXvdgH_Xcsw,2026-06-04T10:00:01Z,22,https://i.ytimg.com/vi/0KHh-qr1_Bw/default.jpg,228142,13454,327
-nBRN3Vo4bo,A Little Setback..!,The Chateau Diaries,UCyqPuqFXuAP5GMwRNFg5hpA,2026-06-04T22:15:06Z,22,https://i.ytimg.com/vi/-nBRN3Vo4bo/default.jpg,114791,14917,593
0EORqavAsPs,"Where Have We Been, A Personal Update & Getting Ready For The Graduation Party! | Home Vlog",TheTimTracker,UCoocMG5lMACNKgpvqKay2lg,2026-06-03T15:52:43Z,19,https://i.ytimg.com/vi/0EORqavAsPs/default.jpg,113270,7287,1978
DKDmQVwGNPg,Dollar Tree Dior & Chanel Dupes JUST DROPPED! ✨ 👀,Do It On A Dime,UCJA8OyDxRY-wm0ya2gtHOsw,2026-06-02T18:02:08Z,26,https://i.ytimg.com/vi/DKDmQVwGNPg/default.jpg,139360,9980,255
GUJxgQ5ACSw,MOVE IN VLOG | IL to GA!🩷#grwm#morning#vlog#diml#moving#travel#aesthetic#skincare#house#drivewithme,Kaitlyn Johnson,UCLWNKb7pjIS_ff4zaoneJWQ,2026-06-02T19:55:50Z,22,https://i.ytimg.com/vi/GUJxgQ5ACSw/default.jpg,153313,18482,267
KXz_heQq7Eo,day in the life vlog as the owner of @bunandcovy 🩵💐🐰🧁,Lisi Shops,UCYh931jrUVrrISOGV1qyVtw,2026-06-01T20:12:37Z,22,https://i.ytimg.com/vi/KXz_heQq7Eo/default.jpg,260998,22496,371
15dIVxzj1tU,SUMMER day in my life @ HOME ⭐️🩷🪽 ,Nicole Laeno,UCr1nLIQFpNV5DxD22qxGsyQ,2026-05-31T19:00:01Z,26,https://i.ytimg.com/vi/15dIVxzj1tU/default.jpg,338860,14373,653
7y6Jf4KuzgI,A Greedy Etsy Seller Trademarks BookToks “Hot-Girls-Read” And The Community Loses Its Mind ,Ammy Robinson,UC1s1Iy6LJ1JWu52-2Gy8-Cw,2026-06-05T17:46:04Z,22,https://i.ytimg.com/vi/7y6Jf4KuzgI/default.jpg,74485,3422,594
ZkQPYHmCkgc,Treatment Update *Cancer Journey 2026*,tiffanythinks,UCGuL-e-ka0avJT35zFk0o5Q,2026-06-04T16:30:16Z,26,https://i.ytimg.com/vi/ZkQPYHmCkgc/default.jpg,100672,7741,1341
n0fAsXMHDzU,SETTING UP OUR BEDROOM & BATHROOM!! cooking in the new kitchen!!,RemLife,UCXLnGIevWGWK2dPDcvM5-CA,2026-05-29T15:00:13Z,22,https://i.ytimg.com/vi/n0fAsXMHDzU/default.jpg,205664,4953,336
q5kmE-KB58E,day in my life as a new puppy owner | waking up at 6 am + going to the gym + Costco runs,Nely Cuevas,UCiPV7RblxaUF6Z4BpTtlVqA,2026-06-04T04:34:51Z,22,https://i.ytimg.com/vi/q5kmE-KB58E/default.jpg,75364,2606,68
lQjCZT8diEw,Integrating Cattle Panels into Our Garden for Hands-Free Indeterminate Tomato Support Systems,Homesteading with the Zimmermans,UCvoLCarfMRzuq-dLXeuohuw,2026-06-06T11:00:12Z,22,https://i.ytimg.com/vi/lQjCZT8diEw/default.jpg,26621,3106,178
lOdTGnAjz08,Depression cant hit a moving target🥹 #postpartum #vlog,Sierra Ann,UCfzdwrvkTuoBqQDpQVC8gpg,2026-05-31T00:42:05Z,22,https://i.ytimg.com/vi/lOdTGnAjz08/default.jpg,123041,20441,306
gtwiCQycUuI,Pack with me for Europe,Morgan McGuire,UCaeZyWQ8-k8tPWP-aetQ9Tg,2026-05-31T21:20:26Z,22,https://i.ytimg.com/vi/gtwiCQycUuI/default.jpg,140863,12066,58
OVaDbBU4A3U,I Quadrupled My Calories Every Day For 8 Days,Alex Ah Sue,UCV9Fju89m4XlxPHIhL9NThg,2026-05-30T15:00:29Z,24,https://i.ytimg.com/vi/OVaDbBU4A3U/default.jpg,333075,10655,713
mVsPs_UxEOI,"Someone requested a lemon poppyseed loaf on my blog, and someone else requested for me to jazz up",Jessica Secrest,UCxPtWxbojpMGbpQKXPthzuw,2026-06-03T01:03:45Z,22,https://i.ytimg.com/vi/mVsPs_UxEOI/default.jpg,39537,6636,121
1-FcUN3xpRI,WE HAD A BABYYYYY 😭 GRWM catch up !!! 🩷,Whitney Simmons,UCEQi1ZNJiw3YMRwni0OLsTQ,2026-06-01T02:04:36Z,22,https://i.ytimg.com/vi/1-FcUN3xpRI/default.jpg,180840,,294
rcjrZShCXIE,RECHARGE - We're Tired  | RV Family Road Trip | Glen Canyon Dam & Horseshoe Bend,This Alaska Life,UCnHNxlYA4WRyjzMqHCbGNYg,2026-06-02T16:00:10Z,24,https://i.ytimg.com/vi/rcjrZShCXIE/default.jpg,59341,6468,423
MAl8v-1cFGM,Traveling Back Home to Mexico ❤️🇲🇽❤️ Our Life After Deportation,laguerita70 (laguerita70),UCLXitynaGJXzGCZH3Shx3aA,2026-06-01T01:00:22Z,22,https://i.ytimg.com/vi/MAl8v-1cFGM/default.jpg,105041,8144,275
0TQdhQkdKe4,VLOG: reality is setting in + home updates + Walt Disney four seasons + ulta beauty world & more,Kirah Ominique,UCpUtNtqyGxuh3cmfSkMrJMQ,2026-06-05T23:00:53Z,26,https://i.ytimg.com/vi/0TQdhQkdKe4/default.jpg,41392,2334,97
Vp_2ff59wB0,Why your room doesn't look like your Pinterest board | dining room makeover,TheSorryGirls,UCSJWlswfVUgyVliZaEFoaBw,2026-06-02T19:00:31Z,26,https://i.ytimg.com/vi/Vp_2ff59wB0/default.jpg,138137,8920,340
2KzLCqKvOrs,A Huge Life Update and the Future of This Channel,SUV RVing,UC07IPCu6BQGWh0Fdk9Q2Z2w,2026-06-06T13:00:39Z,19,https://i.ytimg.com/vi/2KzLCqKvOrs/default.jpg,17922,3281,643
Ekurm09tJbM,The Second Trimester: A Week in the Life,Matt & Abby Howard,UC3zZX4ttC52HlqVis7eQ-Hg,2026-05-31T02:09:33Z,22,https://i.ytimg.com/vi/Ekurm09tJbM/default.jpg,196282,6061,218
rV-SgCONOG8,locked out of my apartment and no where to go (all nighter vlog),lana ♡,UCyZ4IStyXcaQwx7Xgl3TmWA,2026-05-23T21:39:51Z,24,https://i.ytimg.com/vi/rV-SgCONOG8/default.jpg,396036,29286,1424
T3VR7TjCT9c,a VERY realistic day in my life *so thrilling*,Samantha Jo,UCVVwC2YxuzWi1CAt8b_ZoLw,2026-06-05T21:12:48Z,24,https://i.ytimg.com/vi/T3VR7TjCT9c/default.jpg,31033,1719,172
XM-Dgji4bNQ,grwm to go out 🍸also that lip combo turned out to be perfection ✨ #grwm #chattygrwm #foryou #vlog,Ashley Paige,UCZA8j1IBoxCZ1kmx0BaVa2Q,2026-05-30T16:51:06Z,22,https://i.ytimg.com/vi/XM-Dgji4bNQ/default.jpg,133927,8126,217
i8UUYWxMYkE,transforming our run down garden beds *before & after* | MaCenna Lee,"XO, MaCenna Vlogs",UCxVEsOhpjLTRKNUSA8e0mfA,2026-06-04T00:07:36Z,24,https://i.ytimg.com/vi/i8UUYWxMYkE/default.jpg,64035,6101,200
VpvWObR2y68,My Remote Cabin Has a Serious Problem,Kelly Hays,UCfMHF8GPio8NAeP0loK1VmA,2026-05-31T22:02:48Z,24,https://i.ytimg.com/vi/VpvWObR2y68/default.jpg,116700,9574,729
B8TNxaewpbg,"A Month of Doubt, Gratitude & Growth | Life in Northern Sweden",Jonna Jinton,UCAk3t7WHs2zjsZpopox8Taw,2026-06-01T14:52:36Z,22,https://i.ytimg.com/vi/B8TNxaewpbg/default.jpg,515809,29393,2561
BCgRYRwIsus,q&a!! relationship... throuple... secret lives oc...,Aspyn Ovard ,UCxjZe0qTFXh6jGm54LFWEDw,2026-05-27T19:00:48Z,22,https://i.ytimg.com/vi/BCgRYRwIsus/default.jpg,289131,5084,211
3sSp3-lFCzw,"it's wedding season!! bachelorette weekend, moh prep, & bestie gets married!!",Ava Jules,UCNqLK36Gm214qufpgC5C45w,2026-06-04T18:23:03Z,26,https://i.ytimg.com/vi/3sSp3-lFCzw/default.jpg,58798,2532,87
Td4K64Dc5mY,I don't want to scare you: The Food Crisis will be bad. Let's get ready.,Parkrose Permaculture,UCUpbDOT-OVNBlaQpb9pbd2w,2026-06-01T04:14:33Z,27,https://i.ytimg.com/vi/Td4K64Dc5mY/default.jpg,94236,11756,2502
7n8CC3d_BKQ,Car update 🥲 #fypシ #toyota #cindydionicio #depopseller #dayinmylife #carupdate #newcar #toyotacrown,Cindy Dionicio🦋,UC5Z_NfkksSQl4XmbLa8ZMGQ,2026-06-03T22:49:34Z,22,https://i.ytimg.com/vi/7n8CC3d_BKQ/default.jpg,35443,4119,198
DAuduhxil30,Also SO AFFORDABLE 👏🏼 can’t wait to try!! I’ll keep you guys updated Abbey Yung #hairtok,Haylee Hess,UCvqflBxkC8vOz-qLIaVZysA,2026-05-31T16:03:43Z,22,https://i.ytimg.com/vi/DAuduhxil30/default.jpg,173225,11906,128
kVaYWCb4NEI,Our Brakes Gave Out! (Camping On Panheads Part 2) - Vlog 252,THRASHIN SUPPLY,UCDy-dFyhXDV_7B8oHKSrneQ,2026-06-02T23:00:06Z,2,https://i.ytimg.com/vi/kVaYWCb4NEI/default.jpg,58204,3347,194
4bFNy9s6mP4,Crash Begins,Joe Blogs,UCjniKviAJH0mENoLStpQXmQ,2026-06-06T15:00:32Z,22,https://i.ytimg.com/vi/4bFNy9s6mP4/default.jpg,63478,4731,593
RY2oY2tsj-M,We Gave Our Team Member a Garden Makeover,Epic Gardening,UCSbyncU597LMwb3HhnAI_4w,2026-06-06T19:00:03Z,26,https://i.ytimg.com/vi/RY2oY2tsj-M/default.jpg,11312,917,64
R8DVkyNAJug,"bay area food diaries 😋 (favorite boba shop🧋, NEW wide noodles 🍜, hk cafe) + speaking at youtube ❤️",more meimei,UCqy3lcfmwJhdSvuBnwLsMig,2026-06-04T00:18:15Z,22,https://i.ytimg.com/vi/R8DVkyNAJug/default.jpg,45610,1482,133
5ey9ovlk5qs,"MEXICANAS SobreVIVIENDO en JAPÓN 🇲🇽 ”Embarazada"" 🤰+ Regalo Cool para Ryusei  - Ruthi San ♡ 29 -05-26",Ruthi Family Vlogs,UCOBx8y7hTi0q7AGaZEqPKKg,2026-06-05T12:57:21Z,24,https://i.ytimg.com/vi/5ey9ovlk5qs/default.jpg,142754,8354,516
0W_xapBqAeM,What A Week…..,Gina Jyneen,UCBv95rZbQBPJs0lkyd7nmdg,2026-06-02T18:02:28Z,22,https://i.ytimg.com/vi/0W_xapBqAeM/default.jpg,37770,2063,230
2LRuJToNnSg,I DON'T TRUST THIS BOX!? | Hygge Subscription Unboxing,Alexandria Ryan,UCQBamlN6ATTOkM5m459dAiA,2026-06-03T22:16:54Z,26,https://i.ytimg.com/vi/2LRuJToNnSg/default.jpg,36206,3803,543
dX1c7WSUQUc,Clearing the way for a NEW Chapter on our Build,TheNewbys,UCpN6XuNxJK12U8iICxlMXeA,2026-06-03T17:11:55Z,22,https://i.ytimg.com/vi/dX1c7WSUQUc/default.jpg,74342,11453,1258
gqLgF0weaVg,The Work Is Done. Now We Find Out. (+ a HUGE announcement),Allie Ostrander,UCn5hg2riwFTCNif80JbaA8A,2026-06-03T18:30:11Z,17,https://i.ytimg.com/vi/gqLgF0weaVg/default.jpg,52247,2674,186
0-Xb9_3bOZg,"Tasting My Huge, Juicy Tomatoes with @jacquesinthegarden",Epic Homesteading,UCgfsZHnW6-6uMLmOGu824kQ,2026-06-04T21:32:24Z,26,https://i.ytimg.com/vi/0-Xb9_3bOZg/default.jpg,35938,2353,180
t5stf0o2d24,Our Perfect Weekend in ST. LOUIS! Top Things to Do + Trying DELICIOUS Local Food 🤤,The Endless Adventure,UCEDrRCC0qRtPd5-sSa1hajw,2026-06-02T18:57:24Z,19,https://i.ytimg.com/vi/t5stf0o2d24/default.jpg,56379,4853,224
e3tARsU-JjI,OUTLET SHOPPING HAUL: YSL & CHLOE,Jenee Naylor,UCBkNerkJ8362Pat0Fw7T-uA,2026-06-03T13:00:16Z,26,https://i.ytimg.com/vi/e3tARsU-JjI/default.jpg,48621,4328,224
-SItKOsIiE8,"OUR FIRST LOOK | Chapter 11: crying, laughing, smiling and more",RYKEL,UCIF5tHidsbpZnZgSmbQK-cQ,2026-06-02T19:15:35Z,24,https://i.ytimg.com/vi/-SItKOsIiE8/default.jpg,72151,2660,158
PEMOpy7I2Oc,NEW! SUMMER HOME RESET & REFRESH :: GROCERY HAUL & PREPPING MY HOME FOR SUMMER AS A SINGLE MOM OF 3,This Crazy Life,UCbQj1aJiioDM8g0tmGmtC_w,2026-06-01T17:01:10Z,26,https://i.ytimg.com/vi/PEMOpy7I2Oc/default.jpg,56162,5541,482
dGJ58TG5Vxk,I Fed Myself for 7 Days on Just $50 of Clearance Food | Julia Pacheco,Julia Pacheco,UCi_58-g6BjEkhbYRtXBDTHg,2026-05-31T14:00:03Z,24,https://i.ytimg.com/vi/dGJ58TG5Vxk/default.jpg,69280,4268,1075
4P86AZODZQA,The House Is Sold. Time To Move On,The Indie Projects,UCWq4rBWfctWP0duZwofs61w,2026-06-06T16:31:30Z,22,https://i.ytimg.com/vi/4P86AZODZQA/default.jpg,28422,5202,146
CfA3NaCW5Lk,$1000 Dinner for me + $15 dinner for my family,Shayla Talei,UC5b_CPhlnUEUyhVzX_ARDSA,2026-05-14T19:55:22Z,22,https://i.ytimg.com/vi/CfA3NaCW5Lk/default.jpg,1266025,147425,1159
Qt0AqZpRMhM,PREPARING FOR OUR FIRST GROUP OF GUESTS IN TUSCANY,Nicki Positano,UCiTHbmAiRSsYTK9BRmWsMsA,2026-05-31T15:30:19Z,19,https://i.ytimg.com/vi/Qt0AqZpRMhM/default.jpg,79353,8064,417
yWPuVABQ4gY,"What Made Me Stronger, Pool Add on Fail, If I Were A Boy | Mayhem Vlog",Peyton Maree Charles,UCpJlwAazmvuuuWC9PFTH-Ow,2026-05-31T03:08:13Z,22,https://i.ytimg.com/vi/yWPuVABQ4gY/default.jpg,37961,5464,1102
7U1dDziQUvw,grem for the airport!! ✈️ #travel #grwm #getreadywithme #relatable #morningvlog #makeup #airport,Lauren Kim,UCWSwub1biYJX59p3cSSxR5g,2026-05-30T22:25:58Z,26,https://i.ytimg.com/vi/7U1dDziQUvw/default.jpg,148942,18336,95
GnFcy0cjouo,LLEGAMOS A ECUADOR ✈️🇪🇨 Primer día en Quito,Dalys y Mehmet,UCSvTjyRbdpONErhlvfhfFGA,2026-06-06T16:05:47Z,24,https://i.ytimg.com/vi/GnFcy0cjouo/default.jpg,29108,2980,348
DPT92ODVn9I,Our Family Split Up for a Whole Week (First Time Ever)! | Where Did Everyone Go??,Life As We GOmez,UCVnEvilFBSA4BRgP1xRJ92w,2026-06-03T14:00:18Z,22,https://i.ytimg.com/vi/DPT92ODVn9I/default.jpg,77956,1823,203
-qOftCoMzE4,A MUCH NEEDED LIFE RESET AFTER VACATION !,Life As Nique,UCkd3JAKRLQ-Bo7uxJDazu2Q,2026-06-01T20:06:02Z,24,https://i.ytimg.com/vi/-qOftCoMzE4/default.jpg,46611,2633,127
3IKMlETyfdE,"*first* ALL-STAR CHEER TRY OUTS + some really, really sad news....",JesssFam,UCpE_yAyidJKIsv8mnX1VYzA,2026-06-02T21:39:12Z,22,https://i.ytimg.com/vi/3IKMlETyfdE/default.jpg,51968,1922,96
IgZgyfWe96M,Corvette Camping on the California Coast 🌊,A Tiny Nomad,UC7uI6tQg-A1-Sohv4h3m-3w,2026-06-03T18:59:58Z,22,https://i.ytimg.com/vi/IgZgyfWe96M/default.jpg,35987,3584,374
GEK00F_Lp2s,So the Cottage Garden Has to Wait… + a Rainy Week on the Land,HEY WANDERER,UCTXClH9eLcYtCw0vIZlbsZA,2026-05-31T14:00:29Z,22,https://i.ytimg.com/vi/GEK00F_Lp2s/default.jpg,34741,3929,274
7Mb_5fx7YvY,our homestead changed forever today...,Mr and Mrs Adventure,UC9fSBF61eAEI2JOcFrM2Mng,2026-05-31T14:00:21Z,26,https://i.ytimg.com/vi/7Mb_5fx7YvY/default.jpg,73976,9979,873
3XPcVh9_ggs,Hanging with My Family & My Favorite Home Finds!,Vicki Adams,UCJ859DfHktbOYqLDzX__9cQ,2026-06-02T17:11:37Z,22,https://i.ytimg.com/vi/3XPcVh9_ggs/default.jpg,44423,3131,249
6hxrljfHBGI,First Time Weighing Our Loaded RV! The Number Changed Everything...,Grateful Glamper,UCFuE6zYaSBoN3jDDgxuVRgw,2026-05-31T21:00:19Z,19,https://i.ytimg.com/vi/6hxrljfHBGI/default.jpg,68114,2245,269
oIzBcHl7vz0,SIAH IS GOING TO HIGH SCHOOL!!,R n B Fam,UCRtNYg1TPOdy6kphcV4sWJg,2026-06-01T22:13:21Z,1,https://i.ytimg.com/vi/oIzBcHl7vz0/default.jpg,35229,1062,131
t2cM5E_qguM,"nyc week in our life | healthy homemade meals, first sonny angel unboxing, besties wedding weekend",Brigette and Danielle ,UCn6k8n3uXJrdnUMtfMhm8iA,2026-05-31T19:21:13Z,22,https://i.ytimg.com/vi/t2cM5E_qguM/default.jpg,66854,1207,63
PJ-cprMdKA8,Are you paying attention and preparing accordingly? #farmblog #gardening,Humble Servants Homestead,UCVoeq09rDbd-LL5NFwYIfHw,2026-05-26T13:19:48Z,22,https://i.ytimg.com/vi/PJ-cprMdKA8/default.jpg,263839,47588,2570
fLwZkUuC6Xw,SHOULD WE BUY THIS HOUSE? (NEW HOME TOUR) - S3E114,Aary Vlogs,UCJDi0rEMsc3dsF3H18p3XIQ,2026-06-01T06:52:39Z,22,https://i.ytimg.com/vi/fLwZkUuC6Xw/default.jpg,465343,11947,625
42_ukjkBM6k,Addy Turns 16!,Tic Tac Toy Family,UCYSsTrCYRkAxgINU76yJsSw,2026-05-29T13:45:32Z,24,https://i.ytimg.com/vi/42_ukjkBM6k/default.jpg,366869,3650,380
XqmtoOTUt4Y,They Lied to Me,Sarah Berkowitz,UCwh3ZT6P2DqEsTa9Kc82LuQ,2026-05-30T16:00:29Z,22,https://i.ytimg.com/vi/XqmtoOTUt4Y/default.jpg,54734,4548,278
fCzT-ECV6Nw,longest travel day ever 😩 #travelwithme #travelvlog #flywithme #london #travelday #travel,Lucy Livin,UC7ETT3hWtSpeGAMY_Om-IAQ,2026-06-03T11:41:29Z,26,https://i.ytimg.com/vi/fCzT-ECV6Nw/default.jpg,62262,5718,59
VBIviOmzppA,"hanging & resetting my life 🌟🫧🚕 (routines, updates, baking dot cakes, NYC trip, + more!)",Sara Carrolli,UCqtjdWqX85SKxVwCRgaJbkw,2026-05-31T14:34:40Z,22,https://i.ytimg.com/vi/VBIviOmzppA/default.jpg,70490,3874,107
WudVGG-pS9w, MY TURN TO SPEAK & F$*% WHO DON’T LIKE IT • MY RESPONSE TO THE I DO 👰 • WHY SPECULATE I’LL TELL YOU,Jay Corine,UCD43sKZ5d-Mav9Zy218Xqkw,2026-05-31T22:09:46Z,22,https://i.ytimg.com/vi/WudVGG-pS9w/default.jpg,39546,3947,556
ALnZH7TJnIk,a BUSY weekend in my life | what it’s like managing a business (coffee shop) ,Jacob Macias,UC8ph5g5vKPMGWNgjA72Ur0A,2026-05-31T00:35:11Z,22,https://i.ytimg.com/vi/ALnZH7TJnIk/default.jpg,58853,2236,47
J-xh0BJA0HY,I Keep Returning To Holland America Despite These Problems. Here's Why,Tips For Travellers,UC_qE-Obs2ocdmPXY0TIU-cw,2026-05-30T17:00:20Z,19,https://i.ytimg.com/vi/J-xh0BJA0HY/default.jpg,59504,2449,204
Wb_tI98FT9E,Honoring Those Who Gave All: Memorial Day Cookout | Sharing Recipes,thepressleygirls,UC0o2n1IkGL93VmbTtVrtbsg,2026-05-30T22:55:59Z,10,https://i.ytimg.com/vi/Wb_tI98FT9E/default.jpg,27356,2651,268
Vc1RX7-xLcg,I have to move back to Jamaica 🇯🇲 ,Alicia Kim,UCzq-GBe1v0fkptsNnVr6DHQ,2026-05-30T23:10:52Z,22,https://i.ytimg.com/vi/Vc1RX7-xLcg/default.jpg,57236,3842,214
AIVY93u4TOQ,Empezaron las COMPRAS para Llevar a MEXICO😍🇲🇽 + Me Compre mas Enterizos !!🫢,♡IsabelVlogs♡,UC9a3udCBFwDfL3YVyuPP3Rw,2026-06-01T15:31:23Z,24,https://i.ytimg.com/vi/AIVY93u4TOQ/default.jpg,56584,2084,593
8wcc2yO5dXY,"I went to NYC to RUN a Half Marathon for the First Time | Nyc Vlog, Spa + race (Slow Runner)I DID IT",Edith Cuevas,UCgmZVo_TFCz43gdxRDpu_Tg,2026-06-01T23:00:26Z,22,https://i.ytimg.com/vi/8wcc2yO5dXY/default.jpg,32337,1420,37
izdpT31t8os,"Shopping for curtains? Decor Decisions, Little DIY Jobs & an Unexpected Bee Swarm",Dainty Diaries,UCcx0GWauE1_cQYSkk70y0YA,2026-06-04T18:00:32Z,26,https://i.ytimg.com/vi/izdpT31t8os/default.jpg,33802,4295,372
ehRAvdhS6CI,درد دل + ویدیوهای قدیمی,Mia Plays,UC3Uv6kBh55Jx0Ou0C7-Gudg,2026-05-28T07:48:45Z,24,https://i.ytimg.com/vi/ehRAvdhS6CI/default.jpg,325290,5763,9611
fZ2ao3K98Lo,"A DAY OF FLOWERS, FRIENDSHIP & TUSCAN VIEWS",Aperitivo 50,UCnxYapYSb5nVjKp_TaCPwyw,2026-06-03T15:30:31Z,22,https://i.ytimg.com/vi/fZ2ao3K98Lo/default.jpg,50737,6131,350
H_6-rWFuVg8,SEE YOU SOON! 👶🏼🥹🤍 | MY 27th BIRTHDAY AND LAST VLOG BEFORE BABY NO.2 | MOLLYMAE,MollyMae,UC-F3kTU4V680v550AavEOsQ,2026-06-02T18:30:57Z,22,https://i.ytimg.com/vi/H_6-rWFuVg8/default.jpg,628439,15995,903
tXPfbPckCN8,"I’m Leaving London Again, But I Need To Explain Why",Evan Edinger,UCT7H_xchRHaT9zr5GalIZVA,2026-05-31T17:00:34Z,27,https://i.ytimg.com/vi/tXPfbPckCN8/default.jpg,169685,10846,727
XahtBaEMfCs,These Looksmaxxing Family Vloggers Are BEYOND Disturbing...,Crooked Timber,UC4HRlp7zs7UpIFM67eGjhow,2026-05-27T20:48:06Z,22,https://i.ytimg.com/vi/XahtBaEMfCs/default.jpg,113717,3717,518
WdvoB9G96Os,ASÍ FUE MI CITA PRENATAL A LAS 39 SEMANAS | ¿Inducción? + haul de último momento 🤰,DinaStars,UCzkdyqNEPDzoiaCXwQQxdWw,2026-05-31T18:00:06Z,22,https://i.ytimg.com/vi/WdvoB9G96Os/default.jpg,47850,3847,144
TT2RkwF7cY4,Food Prices Are About to Surge… Start Growing NOW,Self Sufficient Me,UCJZTjBlrnDHYmf0F-eYXA3Q,2026-05-31T11:23:36Z,26,https://i.ytimg.com/vi/TT2RkwF7cY4/default.jpg,75829,6454,862
zeOzcbw0tts,США Переезд Продаю мебель Помощь отовсюду За что я люблю COSTCO Лучшие дети! USA VLOG,Big Big Family in the USA,UCMLqsgXvM6Vs0aiegOdrtLQ,2026-06-05T12:00:21Z,22,https://i.ytimg.com/vi/zeOzcbw0tts/default.jpg,45875,2441,983
wjGw8iGMVL4,ВМЕСТО УСЛУГИ - ХАМСТВО И УГРОЗЫ / Обзор салона красоты в Москве ,Алена Погребняк,UCEHbEJ0GmF_h88oMApwLPsA,2026-06-04T08:30:19Z,26,https://i.ytimg.com/vi/wjGw8iGMVL4/default.jpg,172712,3039,943
4YuGqqLkEko,MORE PROBLEMS WITH MY LONDON APARTMENT! | MY LONDON LIFE,Jo Good - MiddleAgedMinx,UCPdKVL2QgDfBXcIW3jC3B2Q,2026-05-31T08:59:46Z,22,https://i.ytimg.com/vi/4YuGqqLkEko/default.jpg,66834,5281,772
KHAHUgj-ojU,What we ate at a movie theater in the US,Jeanelleats,UCU03NklypYW1AAIoNE2Vh1g,2026-05-22T13:00:22Z,22,https://i.ytimg.com/vi/KHAHUgj-ojU/default.jpg,387825,23684,214
08ZEzpc7qMM,House Tour 🏠 definitivo de Mi Piso en Galicia. Esto me costó todo lo que Cambié…,Anita Mateu,UCFf0_VXN-6sH_hZkcaBRWZw,2026-06-03T19:30:06Z,22,https://i.ytimg.com/vi/08ZEzpc7qMM/default.jpg,82361,8593,651
GM7j-Xo6VmQ,Delivery Day Vlog 🏥 | TOO Emotional🥰 Divyanka Tripathi | Vivek Dahiya,Divyanka Tripathi Dahiya,UCfptQBghypEV0U5cDaW2jsg,2026-05-27T14:00:24Z,26,https://i.ytimg.com/vi/GM7j-Xo6VmQ/default.jpg,2463167,48444,1469
Er43PVh31Zc,I traveled to Russia 🇷🇺 (as a Westerner),Max Roving,UCOxpcQ7KtZc7fd0jhnWS0Sg,2026-05-31T09:17:08Z,19,https://i.ytimg.com/vi/Er43PVh31Zc/default.jpg,141045,8897,1732
U8EH2CSWYuQ,"3년 차 승무원 아줌마의 연간 트레이닝 브이로그, 밥 줄 챙기느라 아이들, 남편 분량 적어서 미리 사과드립니다🙇‍♀️🙏🏻",콜미진 callmejin,UCBqIfMIcfGn1bhP8BWnafAQ,2026-05-31T01:03:11Z,22,https://i.ytimg.com/vi/U8EH2CSWYuQ/default.jpg,181342,11910,483
Z_onrnRgqrQ,WHY I DECIDED TO SELL MY BAGS | Amelia Liana ,Amelia Liana,UC-RX7Rb0D8xmWGWIwL8kvmQ,2026-05-31T08:13:38Z,22,https://i.ytimg.com/vi/Z_onrnRgqrQ/default.jpg,67798,1843,127
ekIq39Nscys,Air India Gave Me a Muslim Meal But No Window Seat ✈️🍛,DCT EATS,UC2aX2oIi2TRzXlzbfbSy_dA,2026-05-10T08:59:13Z,22,https://i.ytimg.com/vi/ekIq39Nscys/default.jpg,2995537,141675,1422
TFb5VZbTWW8,China’s INSANE Bullet Train 🇨🇳 Beijing to Shanghai in Business Class,WildLens by Abrar,UCf1XIplYiqNv9baGsFHwPPQ,2026-05-10T14:53:58Z,19,https://i.ytimg.com/vi/TFb5VZbTWW8/default.jpg,1024375,22801,974
